artist_id,Name,Type,Popularity,Genres,Followers
3vQ0GE3mI0dAaxIMYe5g7z,Paulo Londra,artist,74,"argentine hip hop, trap argentino, trap latino, urbano latino",22189494
69GGBxA162lTqCwzJG5jLp,The Chainsmokers,artist,78,"electropop, pop",20348703
6LqNN22kT3074XbTVUrhzX,Kesha,artist,74,"dance pop, pop",7620554
7jy3rLJdDQY21OgRLCZ9sD,Foo Fighters,artist,77,"alternative metal, alternative rock, modern rock, permanent wave, post-grunge, rock",11191467
6XyY86QOPPrYVGvF9ch6wz,Linkin Park,artist,83,"alternative metal, nu metal, post-grunge, rap metal, rock",24144132
4xRYI6VqpkE3UwrDrAZL8L,Logic,artist,73,"conscious hip hop, hip hop, pop rap, rap",5928932
3TVXtAsR1Inumwj472S9r4,Drake,artist,94,"canadian hip hop, canadian pop, hip hop, pop rap, rap",78233981
0du5cEVh5yTK9QJze8zA0C,Bruno Mars,artist,86,"dance pop, pop",50069856
5YCc6xS5Gpj3EkaYGdjyNK,WOS,artist,68,"argentine indie, trap argentino",3842405
0X2BH1fck6amBIoJhDVmmJ,Ellie Goulding,artist,79,"indietronica, metropopolis, pop, uk pop",12207292
3EXdLajEO02ziZ90P90bSW,Lil Xan,artist,55,cloud rap,2336331
7M83IzPXGA4ClZJ5reW2Ro,Douglas & Vinicius,artist,50,"arrocha, sertanejo pop",129412
0WOxhx4hikIsyF3CRPLC8W,Famous Dex,artist,56,"chicago rap, drill, rap, trap",2484510
5f7VJjfbwm532GiveGC0ZK,Lil Baby,artist,85,"atl hip hop, atl trap, rap, trap",14936414
54R6Y0I7jGUCveDTtI21nb,Boney M.,artist,68,europop,1746880
6LuN9FCkKOj5PcnpouEgny,Khalid,artist,82,"pop, pop r&b",16087845
2wY79sveU1sp5g7SokKOiI,Sam Smith,artist,83,"pop, uk pop",22968815
4WZGDpNwrC0vNQyl9QzF7d,Capital Bra,artist,67,german hip hop,4403331
3AA28KZvwAUcZuOKwyblJQ,Gorillaz,artist,77,"alternative hip hop, modern rock, rock",10736179
3Nrfpe0tUJi4K4DXYWgMUX,BTS,artist,87,"k-pop, k-pop boy group, pop",68193131
7nKeLE1toRtW4M279iS26h,Zay Hilfigerrr,artist,38,viral trap,63055
26VFTg2z8YR0cCuwLzESi2,Halsey,artist,80,"electropop, etherpop, indie poptimism, pop",20698792
3mIj9lX2MWuHmhNCA7LSCW,The 1975,artist,76,"modern alternative rock, modern rock, pop, pov: indie, rock",6845535
6M2wZ9GZgrQXHCFfjv46we,Dua Lipa,artist,86,"dance pop, pop, uk pop",41022197
6icQOAFXDZKsumw3YXyusw,Lil Yachty,artist,75,"atl hip hop, melodic rap, rap, trap",9178470
1RyvyyTE3xzB2ZywiAwp0i,Future,artist,88,"atl hip hop, hip hop, rap, southern hip hop, trap",14535457
7me0S5Z40qVWj3gzyK8aC3,Mc Livinho,artist,71,"funk carioca, funk paulista, funk rj, sertanejo universitario",7497164
0bdfiayQAKewqEvaU6rXCv,MØ,artist,68,"danish pop, electropop, pop, pop dance",1448497
5wyWp867LWGjFmYZXVSFnZ,MERO,artist,65,german hip hop,2055520
4nDoRrQiYLoBzwC5BhVJzF,Camila Cabello,artist,78,"dance pop, pop",31184551
3t5xRXzsuZmMDkQzgOX35S,Robin Schulz,artist,77,"deep euro house, deep house, edm, german dance, pop dance, tropical house",3090910
5INjqkS1o8h1imAzPqGZBb,Tame Impala,artist,78,"australian psych, modern rock, neo-psychedelic, rock",6779233
1anyVhU62p31KFi8MEzkbf,Chance the Rapper,artist,71,"chicago rap, conscious hip hop, hip hop, pop rap, rap",5917656
6Xgp2XMz1fhVYe7i6yNAax,Trippie Redd,artist,79,"melodic rap, rap, trap",8910926
2EMAnMvWE2eb56ToJVfCWs,Bryson Tiller,artist,77,"kentucky hip hop, r&b, rap",7305013
0TnOYISbd1XYRBk9myaseg,Pitbull,artist,81,"dance pop, miami hip hop, pop",10182878
20JZFwl6HVl6yg8a4H3ZqK,Panic! At The Disco,artist,75,pop,11949168
0eHQ9o50hj6ZDNBt6Ys1sD,Yandel,artist,77,"latin hip hop, reggaeton, trap latino, urbano latino",7135290
246dkjvS1zLTtiykXe5h60,Post Malone,artist,89,"dfw rap, melodic rap, pop, rap",41614935
1moxjboGR7GNWYIMWsRjgG,Florence + The Machine,artist,74,"baroque pop, modern rock, uk alternative pop",6497454
3MZsBdqDrRTJihTHQrO6Dq,Joji,artist,79,viral pop,8796245
3NH8t45zOTqzlZgBvZRjvB,PNL,artist,71,"french hip hop, pop urbaine",7439053
4tX2TplrkIP4v05BNC903e,Tom Petty and the Heartbreakers,artist,67,"album rock, classic rock, hard rock, heartland rock, mellow gold, rock, singer-songwriter, soft rock",2568681
0VRj0yCOv2FXJNP47XQnx5,Quavo,artist,79,"atl hip hop, melodic rap",6798400
5AZuEF0feCXMkUCwQiQlW7,Marracash,artist,71,"italian hip hop, italian pop, italian underground hip hop, rap napoletano",2151031
00FQb4jTyendYWaN8pK0wa,Lana Del Rey,artist,89,"art pop, pop",26534532
3c96G4d2lUOxhomM2mby5S,Bushido,artist,60,german hip hop,1234059
0eDvMgVFoNV3TpwtrVCoTj,Pop Smoke,artist,79,"brooklyn drill, rap",12802944
1l8Fu6IkuTP0U5QetQJ5Xt,Fifth Harmony,artist,67,"girl group, pop, talent show",16027121
4ofCBoyEiGSePFAG500xev,Regard,artist,67,"pop dance, pop edm, slap house, uk dance",219081
15UsOTVnJzReFVN1VCnxy4,XXXTENTACION,artist,84,"emo rap, miami hip hop",42585979
6UCQYrcJ6wab6gnQ89OJFh,Headie One,artist,64,uk hip hop,500737
74KM79TiuVKeVCqs8QtB0B,Sabrina Carpenter,artist,76,pop,5750988
1yxSLGMDHlW21z4YXirZDS,Black Eyed Peas,artist,78,"dance pop, pop, pop rap",7621864
6tzRZ39aZlNqlUzQlkuhDV,Pabllo Vittar,artist,65,"dance pop, funk carioca, funk pop, pop lgbtq+ brasileira, pop nacional",4260336
7ltDVBr6mKbRvohxheJ9h1,ROSALÍA,artist,82,"pop, r&b en espanol",7675487
66CXWjxzNUsdJxJ2JdwvnR,Ariana Grande,artist,86,pop,92722195
4MCBfE4596Uoi2O4DtmEMz,Juice WRLD,artist,86,"chicago rap, melodic rap, rap",30203941
7CajNmpbOovFoOoasH2HaY,Calvin Harris,artist,84,"dance pop, edm, electro house, house, pop, progressive house, uk dance",23558038
31W5EY0aAly4Qieq6OFu6I,A Boogie Wit da Hoodie,artist,80,"melodic rap, rap, trap",7618267
4npEfmQ6YuiwW1GpUmaq3F,Ava Max,artist,78,pop,5964824
6t1gpxYbY8OlLA7D2RiikQ,Loud Luxury,artist,69,"edm, pop dance",640678
7d3WFRME3vBY2cgoP38RDo,Lil Skies,artist,66,melodic rap,4995438
1uNFoZAHBGtllmzznpCI3s,Justin Bieber,artist,87,"canadian pop, pop",73691634
711MCceyCBcFnzjGY4Q7Un,AC/DC,artist,79,"australian rock, hard rock, rock",27070580
718COspgdWOnwOFpJHRZHS,Luke Combs,artist,83,"contemporary country, country",9003887
2ysnwxxNtSgbb9t1m2Ur4j,George Ezra,artist,72,"folk-pop, neo-singer-songwriter",4093107
0c173mlxpT3dSFRgMO8XPh,Big Sean,artist,74,"detroit hip hop, hip hop, pop rap, r&b, rap, southern hip hop, trap",11022480
1vCWHaC5f2uS3yhpwWbIA6,Avicii,artist,79,"edm, pop, pop dance",23117611
0ErzCpIMyLcjPiwT4elrtZ,NLE Choppa,artist,78,"memphis hip hop, rap",6548793
1XLWox9w1Yvbodui0SRhUQ,StaySolidRocky,artist,57,melodic rap,172019
4gzpq5DPGxSnKTe4SA8HAU,Coldplay,artist,86,"permanent wave, pop",46336102
4IWBUUAFIplrNtaOHcJPRM,James Arthur,artist,80,"pop, talent show, uk pop",12841346
0hCNtLu0JehylgoiP8L4Gh,Nicki Minaj,artist,86,"hip pop, pop, queens hip hop, rap",29064669
1Xyo4u8uXC1ZmMpatF05PJ,The Weeknd,artist,94,"canadian contemporary r&b, canadian pop, pop",69417099
0vR2qb8m9WHeZ5ByCbimq2,Reik,artist,76,"latin arena pop, latin pop, mexican pop, reggaeton",8446495
2FwJwEswyIUAljqgjNSHgP,Snakehips,artist,61,"electropop, uk dance",356057
2ayNSoKPCRAfjp6hQ76hRu,Nacho,artist,61,"latin pop, pop venezolano, reggaeton, trap latino, urbano latino",5354211
5pVRwX5ZQR7hfJ18w8ZYkl,Ufo361,artist,69,"german cloud rap, german hip hop",1920746
0Y5tJX1MQlPlqiwlOH1tJY,Travis Scott,artist,94,"hip hop, rap, slap house",23519791
0NnUMWDCDi1snuMja6IdxH,Harry Nach,artist,61,"trap chileno, urbano chileno",281660
4GvEc3ANtPPjt1ZJllr5Zl,Bazzi,artist,69,pop,5498992
1i8SpTcr7yvPOmcqrbnVXY,Ozuna,artist,85,"puerto rican pop, reggaeton, trap latino, urbano latino",37675259
4LEiUm1SRbFMgfqnQTwUbQ,Bon Iver,artist,73,"chamber pop, eau claire indie, indie folk, melancholia, modern rock",3457774
3WGpXCj9YhhfX11TToZcXP,Troye Sivan,artist,75,"australian pop, pop, viral pop",7780207
6oMuImdp5ZcFhWP0ESe6mG,Migos,artist,74,"atl hip hop, hip hop, pop rap, rap, trap",13376704
7DMveApC7UnC2NPfPvlHSU,Cheat Codes,artist,66,"edm, pop, pop dance",2187132
5Lv2GUVwqmQBPwrTrxucE5,Os Barões Da Pisadinha,artist,66,"agronejo, arrocha, forro, piseiro, sertanejo universitario",6845180
0XHiH53dHrvbwfjYM7en7I,Chris Cornell,artist,58,"alternative metal, alternative rock, grunge, hard rock, nu metal, post-grunge, rock",2039013
5Rl15oVamLq7FbSb0NNBNy,5 Seconds of Summer,artist,75,"boy band, pop",9565236
1W7FNibLa0O0b572tB2w7t,Pink Sweat$,artist,66,bedroom soul,1735444
2o5jDhtHVPhrJdv3cEQ99Z,Tiësto,artist,82,"big room, brostep, dutch edm, edm, house, pop dance, slap house, trance",7047988
2YZyLoL8N0Wb9xBt1NhZWg,Kendrick Lamar,artist,87,"conscious hip hop, hip hop, rap, west coast rap",24970561
6jJ0s89eD6GaHleKKya26X,Katy Perry,artist,82,pop,28613704
1GDbiv3spRmZ1XdM1jQbT7,NATTI NATASHA,artist,71,"latin pop, rap latina, reggaeton, urbano latino",9295935
0YinUQ50QDB7ZxSCLyQ40k,Mustard,artist,70,"cali rap, pop rap, rap, southern hip hop, trap",1085703
1URnnhqYAYcrqrcwql10ft,21 Savage,artist,89,"atl hip hop, hip hop, rap, trap",14455611
5j21TGkrNEAJe3gG9VlS34,Shindy,artist,65,german hip hop,863236
1qQLhymHXFPtP5U8KNKsm6,Apache 207,artist,74,german hip hop,2438886
4DdkRBBYG6Yk9Ka8tdJ9BW,Offset,artist,78,"atl hip hop, hip hop, pop rap, rap, trap",2874572
7Do8se3ZoaVqUt3woqqSrD,MACHETE,artist,53,"italian hip hop, italian pop, trap italiana",445190
2jnIB6XdLvnJUeNTy5A0J2,Why Don't We,artist,66,"boy band, pop",3619640
1o2NpYGqHiCq7FoiYdyd1x,Bea Miller,artist,64,"alt z, pop, talent show",3105823
1Ffb6ejR6Fe5IamqA5oRUF,Bring Me The Horizon,artist,77,"melodic metalcore, metalcore, modern rock, pop punk, rock, uk metalcore",5012266
3hBQ4zniNdQf1cqqo6hzuW,Salmo,artist,67,"italian hip hop, italian pop, italian underground hip hop, rap sardegna",2392242
6KImCVD70vtIoJWnq6nGn3,Harry Styles,artist,86,pop,28782949
3drqpTL4sQOckmAfF9i1wg,Summer Cem,artist,67,german hip hop,1102701
4O15NlyKLIASxsJ0PrXPfz,Lil Uzi Vert,artist,86,"hip hop, melodic rap, philly rap, rage rap, rap, trap",15668067
3hv9jJF3adDNsBSIQDqcjp,Mark Ronson,artist,72,pop soul,1032354
2uFC1dAj5b0YU7vulKNZ0p,Banx & Ranx,artist,54,basshall,21631
0C0XlULifJtAgn6ZNCW2eu,The Killers,artist,74,"alternative rock, dance rock, modern rock, permanent wave, rock",7077553
2x7PC78TmgqpEIjaGAZ0Oz,Trueno,artist,70,"argentine hip hop, bases de freestyle, trap argentino, trap latino, urbano latino",4988239
1SupJlEpv7RS2tPNRaHViT,Nicky Jam,artist,80,"latin hip hop, reggaeton, trap latino, urbano latino",19124428
21dooacK2WGBB5amYvKyfM,Smokepurpp,artist,58,"melodic rap, miami hip hop, trap, underground hip hop",2455218
5KNNVgR6LBIABRIomyCwKJ,Dermot Kennedy,artist,71,"folk-pop, irish pop, uk pop",1395240
3wyVrVrFCkukjdVIdirGVY,Lil Pump,artist,63,"emo rap, miami hip hop, pop rap, rap, trap",8005238
6LnJKrtFnTEGdbWQ2riWCL,Ezhel,artist,69,"turkish hip hop, turkish trap",5911868
6hkKbkZGvAXuvle2FhCnxy,Shablo,artist,61,"italian hip hop, italian pop",49020
6ydoSd3N2mwgwBHtF6K7eX,Calum Scott,artist,74,pop,5260720
4UXqAaa6dQYAk18Lv7PEgX,Fall Out Boy,artist,79,"emo, modern rock, pop, pop punk, rock",10201377
181bsRPaVXVlUKXrxwZfHK,Megan Thee Stallion,artist,75,"houston rap, pop, rap, trap queen",7855360
0QHgL1lAIqAw0HtD7YldmP,DJ Khaled,artist,74,"hip hop, miami hip hop, pop rap, rap",10197209
7c0XG5cIJTrrAgEC3ULPiq,Ty Dolla $ign,artist,78,"hip hop, pop rap, r&b, southern hip hop, trap, trap soul",4701426
7gXb99Sf9nNmpNYeAgIQFG,Sub Urban,artist,64,modern indie pop,1515894
7dGJo4pcD2V6oG8kP0tJRR,Eminem,artist,88,"detroit hip hop, hip hop, rap",74931735
5p7mWeX4RlvqBCxylfiXdE,KC Rebell,artist,61,"german drill, german hip hop",1197924
4AK6F7OLvEQ5QYCBNiQWHq,One Direction,artist,82,"boy band, pop, post-teen pop, talent show",32519531
4V8LLVI7PbaPR0K2TGSxFF,"Tyler, The Creator",artist,83,"hip hop, rap",12295795
1Bl6wpkWCQ4KVgnASpvzzA,BROCKHAMPTON,artist,64,"boy band, rap",2128730
5DUlefCLzVRzNWaNURTFpK,Cali Y El Dandee,artist,67,"colombian pop, electro latino, latin pop, reggaeton, reggaeton colombiano, trap latino, urbano latino",3961193
1cNDP5yjU5vjeR8qMf4grg,YNW Melly,artist,73,"melodic rap, rap",9363763
137W8MRPWKqSmrBGDBFSop,Wiz Khalifa,artist,79,"hip hop, pittsburgh rap, pop rap, rap, southern hip hop, trap",11158953
74XFHRwlV6OrjEM0A2NCMF,Paramore,artist,77,"candy pop, pixie, pop, pop emo, pop punk, rock",7975571
23fqKkggKUBHNkbKtXEls4,Kygo,artist,77,"edm, pop, pop dance, tropical house",8415208
6VuMaDnrHyPL1p4EHjYLi7,Charlie Puth,artist,81,"pop, viral pop",21001979
3gd8FJtBJtkRxdfbTu19U2,Mumford & Sons,artist,70,"modern folk rock, modern rock, neo mellow, stomp and holler, uk americana",6533048
04gDigrS5kc9YWfZHwBETP,Maroon 5,artist,83,pop,41187499
23TFHmajVfBtlRx5MXqgoz,Sfera Ebbasta,artist,79,"italian hip hop, italian pop, trap italiana, trap latino",5616372
1r4hJ1h58CWwUQe3MxPuau,Maluma,artist,82,"latin pop, reggaeton, reggaeton colombiano, trap latino, urbano latino",34330215
7n2wHs1TKAczGzO7Dd2rGr,Shawn Mendes,artist,81,"canadian pop, pop, viral pop",42202849
6wWVKhxIU2cEi0K81v7HvP,Rammstein,artist,78,"german metal, industrial, industrial metal, industrial rock, neue deutsche harte",8511988
1Cs0zKBU1kc0i8ypK3B9ai,David Guetta,artist,86,"big room, dance pop, edm, pop, pop dance",26445596
1HY2Jd0NmPuamShAr6KMms,Lady Gaga,artist,83,"art pop, dance pop, pop",27505010
293zczrfYafIItmnmM3coR,Chuck Berry,artist,64,"blues, blues rock, classic rock, rock, rock-and-roll, rockabilly, soul",1844539
2hPgGN4uhvXAxiXQBIXOmE,KIDS SEE GHOSTS,artist,57,rap,923690
1Xylc3o4UrD53lo9CvFvVg,Zara Larsson,artist,74,"pop, scandipop, swedish electropop, swedish pop",10383559
0C8ZW7ezQVs4URX5aX7Kqx,Selena Gomez,artist,81,"pop, post-teen pop",44210760
4STHEaNw4mPZ2tzheohgXB,Paul McCartney,artist,68,"beatlesque, classic rock, mellow gold, rock",4489138
6qqNVTkY8uBg9cP3Jd7DAH,Billie Eilish,artist,88,"art pop, electropop, pop",84331151
6h1s4i4XKIYv4ErDelLDN0,Samra,artist,66,german hip hop,1259209
3ATyg4fGC9F8trfb0GRWmX,Joey Montana,artist,57,"latin pop, reggaeton, urbano latino",2770303
3gIRvgZssIb9aiirIg0nI3,Jeremy Zucker,artist,69,"alt z, electropop, pop",2186043
540vIaP2JwjQb9dm3aArA4,DJ Snake,artist,76,"edm, electronic trap, pop, pop dance",8664798
7n2Ycct7Beij7Dj7meI4X0,TWICE,artist,78,"k-pop, k-pop girl group, pop",18497671
2yEwvVSSSUkcLeSTNyHKh8,TOOL,artist,67,"alternative metal, art rock, nu metal, post-grunge, progressive metal, progressive rock, rock",3248930
4NHQUGzhtTLFvgF5SZesLK,Tove Lo,artist,72,"metropopolis, pop, swedish electropop, swedish pop, swedish synthpop",3468165
5zctI4wO9XSKS8XwcnqEHk,Lil Mosey,artist,67,"melodic rap, rap conscient",5177914
0A0FS04o6zMoto8OKPsDwY,YG,artist,72,"cali rap, hip hop, pop rap, rap, southern hip hop, trap",3141648
5vBSrE1xujD2FXYRarbAXc,Years & Years,artist,66,"gauze pop, pop, uk pop",1973225
4r63FhuTkUYltbVAg5TQnk,DaBaby,artist,79,"hip hop, north carolina hip hop, pop rap, rap, trap",11057664
1z4g3DjTBBZKhvAroFlhOM,Red Velvet,artist,68,"k-pop, k-pop girl group",8641330
2LIk90788K0zvyj2JJVwkJ,Jack Harlow,artist,77,"deep underground hip hop, kentucky hip hop, pop rap, rap",2968427
6extd4B6hl8VTmnlhpl2bY,Huncho Jack,artist,56,"melodic rap, rap, trap",1150527
55fhWPvDiMpLnE4ZzNXZyW,Noah Cyrus,artist,68,"alt z, pop",1192640
3YQKmKGau1PzlVlkL1iodx,Twenty One Pilots,artist,78,"modern rock, pop, pov: indie, rock",23933762
1bAftSH8umNcGZ0uyV7LMg,Duki,artist,84,"argentine hip hop, trap argentino, trap latino, trap triste, urbano latino",9176345
27w1NoOLMX7tJMYqcetPyG,VIC MENSA,artist,56,"canadian hip hop, chicago rap, conscious hip hop, rap, underground hip hop",612694
50co4Is1HCEo8bhOyUWKpn,Young Thug,artist,84,"atl hip hop, atl trap, gangster rap, melodic rap, rap, trap",8715727
0b1sIQumIAsNbqAoIClSpy,j-hope,artist,70,"k-pop, k-rap",15594537
7A8S43ryYdbWpJKeHRZRcq,JACKBOYS,artist,63,pop rap,540944
1l7ZsJRRS8wlW3WfJfPfNS,Christina Aguilera,artist,75,"dance pop, pop",7712695
5CiGnKThu5ctn9pBxv7DGa,benny blanco,artist,69,pop,1060988
4bw2Am3p9ji3mYsXNXtQcd,Piso 21,artist,73,"colombian pop, latin pop, reggaeton, reggaeton colombiano, trap latino, urbano latino",9154692
7jdFEYD2LTYjfwxOdlVjmc,KALEO,artist,68,"icelandic indie, icelandic rock, modern alternative rock",1603063
6Te49r3A6f5BiIgBRxH7FH,Ninho,artist,79,"french hip hop, pop urbaine",8471318
5H1nN1SzW0qNeUEZvuXjAj,Danny Ocean,artist,75,"pop venezolano, reggaeton, trap latino, urbano latino",5144560
7iLc4hrjOjQPfg1E3cCHg1,Tim Berg,artist,50,"edm, pop dance, progressive electro house",212772
0hEurMDQu99nJRq8pTxO14,John Mayer,artist,75,"neo mellow, singer-songwriter",5927150
7z5WFjZAIYejWy0NI5lv4T,Dan + Shay,artist,71,"contemporary country, country, country road",3024034
163tK9Wjr9P9DmM0AVK7lm,Lorde,artist,74,"art pop, metropopolis, nz pop, pop",9978766
06HL4z0CvFAxyc27GXpf02,Taylor Swift,artist,100,pop,82377431
09EYYUcfEDOvj3D5f45L99,MC Ingryd,artist,43,funk 150 bpm,97857
2rhFzFmezpnW82MNqEKVry,Ski Mask The Slump God,artist,72,"hip hop, miami hip hop, pop rap, rap, trap, underground hip hop",5497524
0RqtSIYZmd4fiBKVFqyIqD,Thirty Seconds To Mars,artist,67,"modern rock, post-grunge",3390040
3CJKkU0XuElRT1z8rEtIYg,Luciano,artist,72,"german drill, german hip hop",1915232
7iK8PXO48WeuP03g8YR51W,Myke Towers,artist,87,"reggaeton, trap latino, urbano latino",12064072
3Gm5F95VdRxW3mqCn8RPBJ,Aminé,artist,68,"pop rap, portland hip hop, rap, underground hip hop",1879374
2feDdbD5araYcm6JhFHHw7,Labrinth,artist,77,"indie poptimism, pop",3001396
4ScCswdRlyA23odg9thgIO,Jess Glynne,artist,70,"pop, uk pop",3012139
4gOc8TsQed9eqnqJct2c5v,K/DA,artist,62,k-pop girl group,2078675
6Ha4aES39QiVjR0L2lwuwq,Yo Gotti,artist,67,"dirty south rap, gangster rap, memphis hip hop, rap, southern hip hop, tennessee hip hop, trap",4340051
5YGY8feqx7naU7z4HrwZM6,Miley Cyrus,artist,84,pop,21734604
0vRvGUQVUjytro0xpb26bs,Arizona Zervas,artist,64,"pop rap, rhode island rap",725678
699OTQXzgjhIYAHMy9RyPD,Playboi Carti,artist,84,"atl hip hop, plugg, pluggnb, rage rap, rap",8569785
5wPoxI5si3eJsYYwyXV4Wi,N.E.R.D,artist,55,"hip hop, virginia hip hop",813789
1vyhD5VmyZ7KMfW5gqLgo5,J Balvin,artist,84,"reggaeton, reggaeton colombiano, trap latino, urbano latino",37699169
7qG3b048QCHVRO5Pv1T5lw,Enrique Iglesias,artist,75,"dance pop, latin pop, mexican pop",11288300
4kYSro6naA4h99UJvo89HB,Cardi B,artist,78,"pop, rap",21937038
0chh7dlaUzEreDTulHiOlm,KEiiNO,artist,43,"norwegian pop, sami",51930
5K4W6rqBFWDnAN6FQUkS6x,Kanye West,artist,88,"chicago rap, hip hop, rap",20840514
602DnpaSXJB4b9DZrvxbDc,Peggy Lee,artist,55,"adult standards, torch song, vocal jazz",413280
7rkW85dBwwrJtlHRDkJDAC,NAV,artist,75,"canadian hip hop, canadian trap, melodic rap, rap, trap",3358487
02A3cEvlLLCbIMVDrK2GHV,Starley,artist,52,aussietronica,205353
1mcTU81TzQhprhouKaTkpq,Rauw Alejandro,artist,88,"puerto rican pop, reggaeton, trap latino, urbano latino",17898832
68Uwx1d3EbjDJhYsLjqvIq,Emma Stone,artist,55,hollywood,38567
6JL8zeS1NmiOftqZTRgdTz,Meghan Trainor,artist,75,"hip pop, pop",13658702
5IcR3N7QB1j6KBL8eImZ8m,ScHoolboy Q,artist,70,"gangster rap, hip hop, pop rap, rap, southern hip hop, trap",4569261
1aS5tqEs9ci5P9KD9tZWa6,Bonez MC,artist,74,"german hip hop, hamburg hip hop",2127626
0epOFNiUfyON9EYx7Tpr6V,The Strokes,artist,74,"alternative rock, garage rock, modern rock, permanent wave, rock",5126131
6l3HvQ5sa6mXTsMTB19rO5,J. Cole,artist,84,"conscious hip hop, hip hop, north carolina hip hop, rap",20991348
7gOdHgIoIKoe4i9Tta6qdD,Jonas Brothers,artist,76,"boy band, pop",7133904
64M6ah0SkkRsnPGtGiRAbb,Bebe Rexha,artist,79,"dance pop, pop",8396567
4SsVbpTthjScTS7U2hmr1X,Arcángel,artist,81,"latin hip hop, reggaeton, trap latino, urbano latino",11662949
14D0I0RYqvIorkPL2EWoQh,MC WM,artist,53,funk carioca,3283092
7IlRNXHjoOCgEAWN5qYksg,Aya Nakamura,artist,69,"basshall, pop urbaine, r&b francais",4169496
7gZfnEnfiaHzxARJ2LeXrf,6ix9ine,artist,71,emo rap,6952705
02kJSzxNuaWGqwubyUba0Z,G-Eazy,artist,73,"indie pop rap, oakland hip hop, pop rap, rap",5189765
4VMYDCV2IEDYJArk749S6m,Daddy Yankee,artist,85,"latin hip hop, reggaeton, trap latino, urbano latino",33571768
4ZgQDCtRqZlhLswVS6MHN4,grandson,artist,65,"modern alternative rock, modern rock, pov: indie, rock",1076705
2HPaUgqeutzr3jx5a9WyDV,PARTYNEXTDOOR,artist,75,"r&b, rap, urban contemporary",5541883
0EmeFodog0BfCgMzAIvKQp,Shakira,artist,86,"colombian pop, dance pop, latin pop, pop",30732762
6ZjFtWeHP9XN7FeKSUe80S,Bing Crosby,artist,52,"adult standards, easy listening, lounge",460619
0EeQBlQJFiAfJeVN2vT9s0,Nipsey Hussle,artist,65,"conscious hip hop, gangster rap, hip hop, pop rap, rap, southern hip hop, trap",3258896
55Aa2cqylxrFIXC767Z865,Lil Wayne,artist,84,"hip hop, new orleans rap, pop rap, rap, trap",13903935
5nP8x4uEFjAAmDzwOEc9b8,Matuê,artist,74,"r&b brasileiro, rap cearense, trap brasileiro",8877029
77SW9BnxLY8rJ0RciFqkHh,The Neighbourhood,artist,81,"modern alternative rock, modern rock, pop",13233171
64KEffDW9EtZ1y2vBYgq8T,Marshmello,artist,81,"brostep, edm, pop, progressive electro house",35251835
3PhoLpVuITZKcymswpck5b,Elton John,artist,81,"glam rock, mellow gold, piano rock, rock",12024161
2R21vXR83lH98kGeO99Y66,Anuel AA,artist,86,"reggaeton, reggaeton flow, trap boricua, trap latino, urbano latino",31328312
1Hsdzj7Dlq2I7tHP7501T4,Niall Horan,artist,75,pop,9724329
7FNnA9vBm6EKceENgCGRMb,Anitta,artist,76,"funk pop, funk rj, pagode baiano, pop, pop nacional",13008563
2WxjxdeF7GGdcCK276qViY,Natalie Taylor,artist,56,,160181
4Gso3d4CscCijv0lmajZWs,Don Toliver,artist,81,"pop rap, rap, trap",3130447
6Ff53KvcvAj5U7Z1vojB5o,*NSYNC,artist,65,"boy band, dance pop, pop",2041803
47MpMsUfWtgyIIBEFOr4FE,Lunay,artist,68,"reggaeton, reggaeton flow, trap latino, urbano latino",8723613
07YUOmWljBTXwIseAUd9TW,Sebastian Yatra,artist,79,"colombian pop, latin pop, reggaeton, reggaeton colombiano, urbano latino",22132529
4q3ewBCX7sLwd24euuV69X,Bad Bunny,artist,94,"reggaeton, trap latino, urbano latino",72659297
1bqxdqvUtPWZri43cKHac8,MAX,artist,65,"singer-songwriter pop, viral pop",828080
5eioJDe26lOqkAMbuhzZYs,Gzuz,artist,70,"deep german hip hop, german hip hop, hamburg hip hop",1358467
5qa31A9HySw3T7MKWI9bGg,FLETCHER,artist,63,"alt z, pop",809277
3JhNCzhSMTxs9WLGJJxWOY,Macklemore,artist,75,"pop rap, seattle hip hop",2104615
3Isy6kedDrgPYoTS1dazA9,Sean Paul,artist,79,"dance pop, dancehall, pop, pop rap",4446421
2JyWXPbkqI5ZJa3gwqVa0c,Craig David,artist,62,british soul,863766
0NGAZxHanS9e0iNHpR8f2W,Alok,artist,77,"electro house, pop nacional, sertanejo universitario, slap house",12205506
0u2FHSq3ln94y5Q57xazwf,Keith Urban,artist,68,"australian country, australian pop, contemporary country, country, country road",5198841
21451j1KhjAiaYKflxBjr1,Zion & Lennox,artist,75,"reggaeton, urbano latino",7515681
1LZEQNv7sE11VDY3SdxQeN,Bee Gees,artist,75,"disco, mellow gold, soft rock",7069594
63yrD80RY3RNEM2YDpUpO8,Melanie Martinez,artist,79,"alt z, electropop, pop",18029081
25uiPmTg16RbhZWAqwLBy5,Charli XCX,artist,76,"art pop, candy pop, metropopolis, pop, uk pop",2931000
53XhwfbYqKCa1cC15pYq2q,Imagine Dragons,artist,85,"modern rock, pop, rock",49510206
2urF8dgLVfDjunO0pcHUEe,Alvaro Soler,artist,65,latin pop,1731640
1LOB7jTeEV14pHai6EXSzF,Cash Cash,artist,60,"dance pop, edm, electro house, electropowerpop, pop dance",688293
0GM7qgcRCORpGnfcN2tCiB,Tainy,artist,81,"pop reggaeton, reggaeton, trap latino, urbano latino",1609863
5JZ7CnR6gTvEMKX4g70Amv,Lauv,artist,74,pop,5872219
6lB8vOoI4DRrrVxXwuV19c,Mike Perry,artist,65,"pop dance, swedish tropical house",1531406
0tmwSHipWxN12fsoLcFU3B,Manuel Turizo,artist,82,"colombian pop, reggaeton, reggaeton colombiano, trap latino, urbano latino",12688613
6eUKZXaKkcviH0Ku9w2n3V,Ed Sheeran,artist,87,"pop, singer-songwriter pop, uk pop",114163489
2hlmm7s2ICUX0LVIhVFlZQ,Gunna,artist,84,"atl hip hop, melodic rap, rap, trap",5680065
73sIBHcqh3Z3NyqHKZ7FOL,Childish Gambino,artist,76,"atl hip hop, hip hop, rap",11226428
6Kz7MXIUFMtp5Ts91lagtR,Mikolas Josef,artist,56,czech pop,84437
2cnMpRsOVqtPMfq7YiFE6K,Van Halen,artist,71,"album rock, classic rock, hard rock, rock",5541248
2UwqpfQtNuhBwviIC0f2ie,Damso,artist,73,"belgian hip hop, french hip hop, pop urbaine, r&b francais, rap belge, rap conscient",4723734
6qrqAYlS6lUj2BVXax7SZW,Mc Jacaré,artist,66,"arrochadeira, deboxe, funk 150 bpm, funk mtg, funk rj, trap funk",308395
7cjh6y0V9SsyCrWSXTzwOs,RBD,artist,67,latin pop,1752035
7Ln80lUS6He07XvHI8qqHH,Arctic Monkeys,artist,84,"garage rock, modern rock, permanent wave, rock, sheffield indie",21013761
4LLpKhyESsyAXpc4laK94U,Mac Miller,artist,81,"hip hop, pittsburgh rap, pop rap, rap",9338883
1iNqsUDUraNWrj00bqssQG,Dreamville,artist,67,"hip hop, pop rap, rap, underground hip hop",549642
57WHJIHrjOE3iAxpihhMnp,Louis Tomlinson,artist,66,pop,6952181
2kCcBybjl3SAtIcwdWpUe3,Lil Peep,artist,80,"cloud rap, emo rap, lgbtq+ hip hop",10480633
1CoZyIx7UvdxT5c8UkMzHd,Jorja Smith,artist,72,"r&b, uk contemporary r&b",3204915
6vWDO969PvNqNYHIOW5v0m,Beyoncé,artist,85,"pop, r&b",35510210
56oDRnqbIiwx4mymNEv7dS,Lizzo,artist,75,"escape room, minnesota hip hop, pop, trap queen",5625763
3iOvXCl6edW5Um0fXEBRXy,The xx,artist,64,"downtempo, dream pop, indietronica",3904102
38EmEgXkgK51MT2tPY0EoC,Bobby Helms,artist,42,,31408
7eLcDZDYHXZCebtQmVFL25,Aitana,artist,73,"latin talent show, spanish pop",2713109
3yiEJ9SByXZMXTwaKdVFN4,Luchè,artist,65,"italian hip hop, italian pop, rap napoletano",1075559
35S20clEkkSNUo23ViaslZ,Band Aid,artist,34,musical advocacy,25954
1zNqQNIdeOUZHb8zbZRFMX,Swae Lee,artist,81,"melodic rap, rap, trap",1778248
2JbE7jUIGtpXSzytnyMg6U,Curtis Waters,artist,49,,87343
3nFkdlSjzX9mRTtwJOzDYB,JAY-Z,artist,82,"east coast hip hop, gangster rap, hip hop, pop rap, rap",8540924
6Ad91Jof8Niiw0lGLLi3NW,YUNGBLUD,artist,67,"british indie rock, modern rock, pov: indie, rock",2112944
4WN5naL3ofxrVBgFpguzKo,Rudimental,artist,68,"pop dance, uk dance, uk funky",1376487
00tVTdpEhQQw1bqdu8RCx2,Blue Öyster Cult,artist,61,"album rock, classic rock, glam metal, hard rock, progressive rock, rock",1453033
0ECwFtbIWEVNwjlrfc6xoL,Eagles,artist,74,"album rock, classic rock, heartland rock, mellow gold, rock, soft rock, yacht rock",9820855
2iK8weavvfS2xJCmzNzNE5,J-AX,artist,58,"italian adult pop, italian pop",2102324
1McMsnEElThX1knmY4oliG,Olivia Rodrigo,artist,84,pop,26912483
